{
  "id": "TRACE-PIC-BRIDGE-009",
  "name": "bridge-array",
  "description": "array bridge exercises bridge_not_object and must produce the exact invalid classification and code.",
  "profile": "trace.pic-trace-bridge.conformance.v1",
  "conformance": {
    "status": "conformant"
  },
  "inputs": {
    "bridge": [],
    "trusted_authorizer_jwk": {
      "kty": "OKP",
      "crv": "Ed25519",
      "x": "A6EHv_POEL4dcN0Y50vAmWfk1jCbpQ1fHdyGZBJVMbg",
      "kid": "key-206"
    },
    "declaration": {
      "impact": "external-side-effect",
      "purpose": "send invoice",
      "metadata": {
        "channel": "email",
        "reference": "INV-7"
      }
    },
    "pic_intent_digest": "sha256:1111111111111111111111111111111111111111111111111111111111111111",
    "pic_args_digest": "sha256:2222222222222222222222222222222222222222222222222222222222222222",
    "tool_call": {
      "name": "send_invoice",
      "arguments": {
        "invoice_id": "INV-7",
        "options": {
          "notify": true
        }
      }
    },
    "transcript": {
      "before": {
        "tool_call": {
          "name": "send_invoice",
          "arguments": {
            "invoice_id": "INV-7",
            "options": {
              "notify": true
            }
          }
        }
      },
      "after": {
        "status": "accepted",
        "receipt_id": "receipt-206"
      }
    },
    "now": 150
  },
  "reproducibility": {
    "authorization_signature": {
      "applicable": false,
      "reason": "bridge_not_object"
    },
    "declaration_digest": {
      "applicable": true,
      "canonical_preimage_base64url": "eyJpbXBhY3QiOiJleHRlcm5hbC1zaWRlLWVmZmVjdCIsIm1ldGFkYXRhIjp7ImNoYW5uZWwiOiJlbWFpbCIsInJlZmVyZW5jZSI6IklOVi03In0sInB1cnBvc2UiOiJzZW5kIGludm9pY2UifQ",
      "canonical_preimage_sha256": "sha256:f46391ea63e45e60c58d36ff6238b9bf0299c83524113aa1d6633f65f85ed4cc"
    },
    "tool_call_digest": {
      "applicable": true,
      "canonical_preimage_base64url": "eyJhcmd1bWVudHMiOnsiaW52b2ljZV9pZCI6IklOVi03Iiwib3B0aW9ucyI6eyJub3RpZnkiOnRydWV9fSwibmFtZSI6InNlbmRfaW52b2ljZSJ9",
      "canonical_preimage_sha256": "sha256:106da6631f4abfa2723ba5b0a48c55264514a23f9d9b43dc0bb9200df6e7a395"
    }
  },
  "coverage": {
    "rule": "bridge_not_object",
    "variant": "array_bridge",
    "declared_defect": "reject_null_only"
  },
  "expected": {
    "case_schema": "valid",
    "bridge_schema": "invalid",
    "conformant_runtime": {
      "classification": "invalid",
      "codes": [
        "bridge_not_object"
      ],
      "result": null
    }
  }
}
